post_pk,user_pk,taken_at,media_type,like_count,comment_count,caption_text,code,thumbnail_url,video_url
3620481360252951641,1131199,2025-04-28 04:37:12+00:00,8,2716,2,"#광고 @incellderm.official  요즘 립 고민 중이라면 무조건 주목👀나 ICD 립오일이랑 립틴트 써보고 입술에 인생 다시 태어나는 줄 알았다니까여...💋 💧 ICD 글로우 립 오일 진짜 한 번 쓱- 발랐을 뿐인데 입술 탱글탱글 물광 미쳤다...✨#볼륨광채립 #물빛광채 #고보습오일입술 볼륨감 살아나는 거 실화? 저점도 고굴절 오일 덕분에 반짝반짝 투명한 광채까지 장착!낮에는 유리알 광택 터지고, 밤에는 슬리핑 마스크처럼 듬뿍 발라주면 다음날 아침 입술이…진짜 물 먹은 복숭아 같아🍑 그리고 이건 진짜 찐인데, 바르면 바를수록 입술이 건강해지는 느낌!호호바씨오일에 잇꽃씨오일, 지모뿌리추출물까지 — 보습이랑 광택 한방에 해결.탄력+진정까지 싹 다 잡은 용암병풀수, 수용성 콜라겐까지 꽉 채웠다고👏  결론은? 반짝 탱글 광채 입술 만들고 싶으면 이거 무조건. 믿고 써봐여. (진심)  💄 ICD 립 틴트 솔직히 틴트는 텍스처가 생명인데... 이거 진짜 미쳤어영.. ✔ 세미 매트살짝 녹은 버터처럼 입술에 스르륵-촉촉하게 시작해서 딱 적당히 보송하게 마무리돼서 요즘 환절기 입술에도 완전 굿.바르는 순간 주름 사이 메꿔주면서 블러 효과까지✨ (요즘 사람들은 다 이런 거 쓰는 거야... 나만 몰랐냐고) 컬러도 취향 저격 🎯 * 03 브릭레드 : 따뜻한 브라운 한 스푼 섞인 벽돌 레드, 진짜 분위기 미쳤다... * 04 이브닝로즈 : 톤다운 핑크? 웬만한 데일리룩에도 무조건 찰떡💕 ✔ 벨벳 매트겉은 보송, 속은 촉촉. 이거 모순 아니냐고 했는데, 얘는 진짜 됨ㅋㅋ구름처럼 가볍게 얇게 밀착되는데, 발색력은 또 어나더레벨임. * 13 시그니처레드 : 쨍하고 시원한 정석 빨강! 딱 주인공 컬러 * 15 심포니핑크 : 부드러운 크림 핑크에 사랑스러움 뿌린 느낌... 그리고 핵심 성분들이 또 스윗해🍯수용성 콜라겐, 히알루론산 버터, 쿠푸아수씨버터, 용암병풀수... 이 정도면 그냥 입술 스파 수준 아냐?  솔직히 말해서, 립오일은 하루 종일 빛나고 싶을 때,립틴트는 오늘 나 좀 분위기 낼 거다 싶을 때 꺼내 쓰면 만족도 100000%  #아이씨디신제품 #아이씨디 #아이씨디립오일 #아이씨디립틴트 #틴트추천 #롱래스팅틴트 #보습립오일",DI-iJ1xzNxZ,,
3621340004804974886,53618769876,2025-04-29 09:03:10+00:00,8,2433,18,"러너들이 직접 선택한 러닝 브랜드 9곳을 소개합니다.🏃🏻전국 곳곳에서 마라톤 대회가 열리며 러닝의 계절이 다가오고 있는데요. 감성적인 무드로 러닝을 예술처럼 풀어낸 브랜드부터, 고기능성 소재로 퍼포먼스를 극대화한 브랜드까지. 여러분의 어떤 러닝 브랜드를 제일 선호하시나요?☑️  📸 사진 내 각 표시",DJBlYw1T9km,,
3615603584928729647,53618769876,2025-04-21 11:05:56+00:00,8,8293,155,"<나폴리 피자 협회> 인증을 받은 국내 핏제리아 9곳을 소개합니다.🍕 정통 나폴리 피자의 기준을 철저히 지키며 AVPN 공식 인증을 받은 이 핏제리아들은 전국 곳곳에 자리하고 있는데요. 월드 챔피언이 운영하는 고양의 포폴로 피자부터 까노토 스타일로 서울 진출을 앞둔 대구 주토피아, 바다 전망을 자랑하는 동해 피아노까지. 피자 좋아하는 친구를 태그해 이 정보를 공유해 주세요.☑️  📍마리오네 - 서울 성동구 광나루로2길 23-1 1층  📍빠넬로 - 서울 마포구 어울마당로5길 29  📍피아노 레스토랑 - 강원도 동해시 동해대로 6270-18 2층  📍주토피아 - 대구광역시 중구 동덕로30길 141 1층  📍피제리아 다 알리 - 대전 유성구 지족로349번길 40-5  📍포폴로피자 - 경기도 고양시 일산동구 정발산로 43-20  📍볼라레 - 서울 서초구 사평대로20길 8  📍지오네 키친 - 대구광역시 남구 현충로 21  📸 썸네일 이미지 : @siso.sign / 사진 내 각 표시",DItNE3gTkov,,
3603725717580198423,53618769876,2025-04-05 01:46:44+00:00,8,26491,189,"독특한 매장이 매력적인 해외 스타벅스 매장 8곳을 소개합니다.☕️ 스타벅스는 지역 특색을 살린 인테리어와 한정판 메뉴, 굿즈로 여행객들의 발길을 사로잡고 있는데요. 1971년 문을 연 스타벅스 1호점부터 스위스 기차 안 매장, 파리의 럭셔리 매장까지 다양한 공간이 준비돼 있습니다. 여러분이 가장 인상 깊게 방문한 스타벅스는 어디인가요?☑️  📸 사진 내 각 표시",DIDAXJgTrIX,,
3627076591698084079,53618769876,2025-05-07 07:00:00+00:00,8,391,9,"#광고 배스킨라빈스(@baskinrobbinskorea)와 우나스(@unas_seoul)가 5월 가정의 달을 맞아 달항아리 케이크를 시즌 한정 출시합니다.🎂 조선백자의 미를 담은 우아한 디자인과 함께 새롭게 개발한 플레이버를 담아냈는데요. 감사를 담은 헤이즐넛 초콜릿칩과 사랑을 담은 유자 마스카포네 2종으로 구성되어 품격 있는 선물을 완성할 수 있습니다. 전국 직영 매장에서 만나볼 수 있으니, 가정의 달 선물 고민 중이신 분들은 참고해 주세요.☑️  📸 @baskinrobbinskorea  사랑을 담은 유자 마스카포네 달항아리, 감사를 담은 헤이즐넛 초콜릿칩 달항아리 - 제조원 : 비알코리아(주)",DJV9vFtTIDv,,
3627069379810472208,53618769876,2025-05-07 06:46:25+00:00,8,396,6,아디다스(@originals_kr)가 떠그클럽(@thug_club)과의 협업을 예고하는 실루엣 티저를 공개했습니다.👀 이미지 속 인물은 추성훈(@akiyamachoo)으로 추정되며 공개 전부터 뜨거운 반응을 얻고 있는데요. 이번 협업은 오는 5월 12일(월) 베일을 벗을 예정입니다.☑️  📸 @originals_kr,DJV8GJHTLEQ,,
3627043559742239167,53618769876,2025-05-07 05:55:07+00:00,8,611,23,"파리의 낭만을 가득 담은 여름 영화제 <시네마 파라디소 루브르 2025>가 오는 7월 2일(수)부터 5일(토)까지 루브르 박물관에서 열립니다.🎞️ 고전 명작부터 다양한 장르의 작품을 무료로 관람할 수 있는 특별한 기회인데요. 영화 이외에도 라이브 콘서트, 푸드트럭 등 다양한 즐길거리를 만나 볼 수 있습니다. 해당 기간 파리 여행을 계획 중이라면 참고해 보세요.☑️  *댓글에 [파리]라고 남겨주시면 <시네마 파라디소 루브르 2025> 사이트 링크 바로 전달드립니다!  📸 루브르 박물관",DJV2OaTTfG_,,
3627024696120035492,53618769876,2025-05-07 05:17:38+00:00,8,828,18,"유니버설 스튜디오 재팬(@universal_studios_japan)에서 <원피스 프리미어 서머 2025>가 오는 7월 1일(화)부터 10월 6일(월)까지 개최됩니다.✨ 원피스 테마의 롤러코스터부터 상디가 요리한 프렌치 코스를 맛볼 수 있는 해적 레스토랑, 밀짚모자 해적단의 모험을 담은 생생한 공연까지 다채로운 즐길 거리가 준비되어 있는데요. ‘원피스 프리미어 쇼’는 유료로 진행되며, 티켓은 5월 8일(목)부터 유니버설 스튜디오 재팬 공식 홈페이지에서 예매할 수 있습니다. 원피스 덕후인 친구를 태그해 이 소식을 알려주세요.☑️  *댓글에 [원피스]라고 남겨주시면 예약 사이트 링크 바로 전달드립니다!  🏷️ 원피스 프리미어 서머 2025 라인업 - 원피스 프리미어 쇼 2025 - 상디의 해적 레스토랑  - 롤러코스터   📸 유니버설 스튜디오 재팬",DJVx76Lzcik,,
3626981983072891302,53618769876,2025-05-07 03:52:47+00:00,8,1235,13,르세라핌(@le_sserafim) 카즈하(@zuhazana)가 룰루레몬(@lululemonkr)의 새로운 앰버서더로 발탁되었습니다.✨ 발레 유망주에서 K-POP 아이돌로 끊임없이 자신을 단련해온 카즈하의 여정이 ‘움직임이 곧 자기 표현’이라는 룰루레몬의 철학과 만나며 강한 시너지를 예고하는데요. 카즈하는 룰루레몬의 애슬레저 웨어를 입고 유연한 자태를 뽐냈습니다. 카즈하와 룰루레몬의 만남 앞으로의 행보를 기대해봅니다.☑️  📸 @lululemonkr,DJVoOWjzTGm,,
3626962514086777540,53618769876,2025-05-07 03:14:06+00:00,8,321,26,"#광고 수원삼성블루윙즈(@suwonsamsungfc) 창단 30주년을 기념해 무신사(@musinsa.official)와 협업한 피크닉 컬렉션이 오는 5월 9일(금) 오후 12시 무신사드롭에서 단독 발매됩니다.✨ 구단의 상징인 빗살 무늬와 날개 패턴을 감각적으로 담아낸 이번 컬렉션은 일상 속에서도 축구의 감성을 느낄 수 있도록 기획되었는데요. 피크닉존과 함께하는 이번 시즌 팬들과의 새로운 연결을 기대케 합니다. 쇼케이스 감상평 이벤트 참여 시 추첨을 통해 30주년 머플러 증정도 하니, 수원 삼성 블루윙즈 팬인 친구를 태그해 이 소식을 알려주세요.☑️   *댓글에 [무신사]라고 남겨주시면 구매 사이트 링크 바로 전달드립니다!   📸 무신사",DJVjzCpzNLE,,
3626949523110954341,53618769876,2025-05-07 02:48:17+00:00,8,3785,10,"멧 갈라의 비공식 전통 ‘화장실 거울 셀피’가 올해도 화제를 모으고 있습니다.✨ 샤넬(@chanelofficial) 앰버서더 제니(@jennierubyjane)는 앙젤(@angele_vl), 휘트니 피크(@whitneypeak), 사브리나 카펜터(@sabrinacarpenter)와 함께 모습을 드러냈고, 로라 해리어(@lauraharrier), 코코 존스(@cocojones) 등도 다채로운 조합의 셀피를 남겼는데요. 지금 슬라이드를 넘겨 비하인드 컷을 확인해 보세요.☑️  📸 @whitneypeak @cocojones @c.syresmith @altonmason",DJVg1_3TQVl,,
