post_pk,user_pk,taken_at,media_type,like_count,comment_count,caption_text,code,thumbnail_url,video_url
3522083835897350146,317234624,2024-12-13 10:18:53+00:00,8,3,42,"쉬운가요? 👀 쉽게 그리려고 옴총 노력했어요 😇  ISA설명을 찾아보면 좋다는 건 알겠는데  도대체 어디서 어떻게 만들어야 하는지 너무 어렵고 복잡하더라고요.   그래서 진짜 쉽고 간단한 내용만 그렸어요. 바로 시작할 수 있게 👍   3년 만기인데 만드는 날짜 기준이에요.  그래서 일찍 만드는게 좋습니다 😘  ⚠️ 첫번째 주의사항은 딱 한가지만 만들 수 있다는 거예요. 주식이나 예금 중 재테크 스타일따라 선택해요.일임형은 전문가에게 맡기는 건데 수수료가 들어요.  증권사 : 미래에셋, 키움 증권 같은 주식거래하는 곳 은행은 : 국민은행 신한은행 등등 입니다. 주로 앱에서 바로 만들 수 있지만 안되는 곳도 있으니 체크가 필요해요.  ⚠️ 주의 사항은 3년간 유지조건이라 해지하면 내가 받은 세금혜택은 토해내야해요. 하지만 내가 넣은 돈(원금)은 자유롭게 인출가능 해요.  ⚠️ 해외주식은 안되고 국내상장 ETF등만 가능!  ⚠️ 일반형은 200만원/서민형은 400만원 까지 이자의 세금 혜택을 받는데 많은사람들이 서민형인데도 불구하고 신청하지않는대요. 간단하니까 업체에 알아보고 꼭 신청하세요. 서민형은 60만원 이득♡  한도가 넘어가도 이자가 9.9%로 일반통장 보단 저렴해요 이 외에도 손익통산 등 장점이 많습니다.  이 만화를 시작으로 자가님이 ISA를 알아가기 시작하면 좋겠어유 😘  유튜브에 짠부님이 ISA 설명이 가장 쉽고 재미있어서 추천드려요 🧡  #인스타툰 #재테크 #ISA",DDg9JaDzogC,,
3392163912538288640,317234624,2024-06-17 04:11:11+00:00,8,3,26,"마음이 힘들때 꼬옥 활용해보세요~! 저는 정말 큰 도움을 받았어요 자가님들께도 분명 도움이 될거예요 💛  <건강가정지원센터>는 다문화라는 단어가 포함되어있는 경우도 있습니다 : )  센터명칭에 건강, 가정 이런 말이 있어서  가족문제만 상담하는 줄알고 못가시는 분들도 계신데 상담내용 구분없이 신청가능했어요~!  ""내가사는 지역 + 건강가정"" 이렇게 검색하시면  가까운 곳에 가실 수 있을거예요 🤓  #심리상담 #인스타툰",C8TYxsivnIA,,
3214849513955902437,317234624,2023-10-16 12:39:08+00:00,8,3,59,"집값 감잡기 ⭐️  12월부터 디딤돌 대출한도에서 -5500만원 해야합니다. 정책이 바뀌었네요 ㅠㅠ   물론 DTI, DSR도 확인해야 해요. 그전에 대략적인 감을 잡으면 저축계획을 세울 수 있어요.  자가님들 내집마련 하이팅!  DTI, DSR은 계산은 ""DSR 계산기""를 추천해요 : )  #나도한다내집마련 👈 시리즈보기  #인스타툰 #부동산",CydcJmVrcPl,,
3625769262834964934,317234624,2025-05-05 11:43:19+00:00,8,3,13,집 구할 때 후회하지 않으려면 기준을 잘 세워야 한다.   모든 조건이 좋은 집에 살면 정말 좋겠지만 그게 어렵다면 <절대O>와 <절대X> 조건을 잘 생각해봐야 한다!   자가님의 절대O/X조건은 무엇인가요?  이것만은 꼭 필요한 것!  이것만은 참을 수 없는 것!   #인스타툰 #월세 #전세 #집구하기,DJRUe80ztnG,,
3625051393461447393,317234624,2025-05-04 11:57:02+00:00,8,3,708,"#광고 지만 요건 놓치지 마세요! 이 원칙을 모르고 집 사면 낭패볼 수 있어요.  꿈에 그리던 내 집을 적당히 감으로 아무거나 사면 10년 동안 안 오를 수도 있거든요🥲  돈 버는 집을 선택하려면  아주 간단한 원칙을 지키면 되는데요.  10년차 부동산 전문가 너나위님께서 5월에만 특별히 무료로 이 원칙을 알려주신대요.   ✅라이브 강의: 5월 8일 오후 7시   댓글로 '내집마련' 써주시는 분들께만 너나위님의 라이브 특강 링크를 공유드릴게요. (🎁특강 참여자분들에게는  <좋은 아파트 고르는 법>전자책까지 선물로 주신대요!)  집 사고도 후회하지 않으려면, 이번 너나위님의 라이브 놓치지 마세요!  #내집마련",DJOxQk3zerh,,
3621466271220358446,317234624,2025-04-29 13:14:03+00:00,8,3,6,"요 기술, 별거 아닌 거 같아도 엄청 유용해요! '화면 축소!' 월세뿐 아니라 전세, 내 집 마련 등 언제든지 활용할 수 있어요.   다음편에는 가격협상 새로운 스킬 쪄올게요 🫡  #인스타툰 #월세",DJCCGLmJd0u,,
3620672360996934066,317234624,2025-04-28 10:56:41+00:00,8,3,4,"#광고 지만 너무 유용한 노란우산2탄!   저도 실제로 가입을 고민했었는데요~!  바로 납부한 금액이 묶인다는 거였어요.  하지만, 노란우산 고객이라면 대출도 이용할 수 있으니 완전 안심하고 가입했어요~!   사업하신다면! 프리랜서라면!  노란우산과 든든하게 함께해요~!   중소기업중앙회 준법지원실 심의필 제25-55호(2025. 4. 8. ~ 2026. 4. 3)  #노란우산 #무이자 #낮은금리 #대출",DI_NlRFTBGy,,
3618513825374698007,317234624,2025-04-25 11:28:04+00:00,8,3,7,집을 파실 건가요? 원하는 때에 손해보지 않고  집 잘 파는 방법 알려드릴게요~!  천원으로 천만원 이상의 가치를 만들어두림 : )  손해보지 않는 <집 파는 방법>의 모든 것! ★일정 : 5월 15일 오후 7시 30분  ★참여 어려우신 분은 영상 공유드려요 ★진행 : 온라인(ZOOM) 강의 ★신청 : 프로필 링크로!  #인스타툰 #부동산,DI3iycITHoX,,
3617779937878885530,317234624,2025-04-24 11:09:57+00:00,8,3,21,8만5천개의 문제를 다 그릴수 없어 이만 줄입니다. 총총   내집마련 했다면서 왜 갑자기 월세구하지? 궁금해 하실 거 같아서 그렸어요~ 이런 롱롱사연이 있었습니다 🥲  다음부터 월세구하기 기술들어갑니다 😎👍 같이 가시죠!  #인스타툰 #누수,DI076-IzkSa,,
3617050641266644686,317234624,2025-04-23 11:00:58+00:00,8,3,9,#광고 지만 여러분께 꼭 알리고 싶었어요!  절세 혜택 톡톡히 보고 있는 키드도 가입한 노란우산~!  든든하고 안전하게 사업할 수 있도록 많은 혜택을 주고 있어요.    제가 사랑하는 땡땡작가님(가명)이 저에게 추천해 주신 것처럼 저도 여러분께 추천할게요!  사업하고 계신가요? 프리랜서인가요?  든든한 비지니스를 위해 왕추강추해요~!    중소기업중앙회 준법지원실 심의필 제25-54호(2025. 4. 8. ~ 2026. 4. 3)  #노란우산 #절세 #인스타툰,DIyWGTvTBbO,,
3626420435233440118,1131199,2025-05-06 09:17:05+00:00,8,2667,5,"#광고 @meditherapy.co.kr  요즘 셀카 찍을 때 턱선 왜 이렇게 신경 쓰이는지…😩그래서 요즘 제가 꽂힌 건 👉 메디테라피 텐션 업 마스크! 그냥 마스크팩이 아니고,턱, 볼, 이마까지 나눠서 붙이는 3분할 패치라진짜 내가 원하는 부위에 ’콕‘ 집중해서 붙일 수 있어서 너무 좋더라구요?? 심지어 순환 촉진을 돕는 카페인 함유 덕분인지 붙이고 있으면 쿨링감 싹 올라오고,뜨겁게 달아올랐던 얼굴 진정되는 느낌이라 여름에 더더욱 찰떡💧(붙이자마자 “어 시원해~” 나오는 거 나만 아님ㅋㅋ) 그리고 이 마스크, 쭈욱쭈욱 늘어나는 하이드로겔이라얼굴에 딱! 밀착돼서 뭐 하다가도 안 떨어지는 거 진짜 대박적👍 요즘 올영세일템으로 인기 많은 이유가 있더라구영!  몇개 더 쟁여두려구요. 히히나처럼 턱선이 고민이라면 진심 추천🙌  *인모톡스 펩타이드 샷 크림 (인모톡스 펩타 샷 크림) 외 2종의 (인모톡스 석션 젯 병행 사용 시) 처진 턱 밑(이중턱) 리프팅(부피), 입가 리프팅(각도), 볼 리프팅(각도), 팔자 리프팅 개선 및 (인모톡스 텐션 업 마스크 병행 사용 시 처진 턱 밑(이중턱) 리프팅(부피), 입가 리프팅(각도), 볼 리프팅(각도), 팔자 리프팅, 일시적인 안면 붓기 완화 개선에 대한 인체적용시험   #메디테라피 #meditherapy #텐션업마스크 #tensionupmask #메디테라피텐션업마스크 #리프팅마스크 #V라인관리 #올영세일",DJToiwYToF2,,
3626318377591349366,1131199,2025-05-06 05:55:03+00:00,2,3050,3,"#협찬 @lecelle.official  어쩌다 5월은 가정의 달=선물의 달이 된걸까요? 히히 올해는 좀 더 주변인 취향 저격한 르셀르로 선물 골라봤어요!  저는 룸스프레이 워낙 좋아해서 다양하게 써보는 편인데,,  르셀르 향기 세상 최고 !  은은하게 잔향이 정말 좋고 거기다가 탈취효과까지 있어서  최고더라고용?  그리고 무엇보다 포장이 넘 예뽀소- 받는 분 누구라도 좋아할 것 같아요!   르셀르는  카카오톡 선물하기, 올리브영에서 만날 수 있고  5/8 - 5/14 판교 현대백화점 5층 비클린 매장에서 팝업도 진행한다고 하니   꼬-옥 들러보세요!   #르셀르 #르셀르서포터즈 #가정의달선물추천 #선물추천",DJTRVnyzaB2,https://scontent-gmp1-1.cdninstagram.com/v/t51.71878-15/495245683_1053412983502934_3611741129010004934_n.jpg?stp=dst-jpg_e15_p360x360_tt6&_nc_cat=107&ig_cache_key=MzYyNjMxODM3NzU5MTM0OTM2Ng%3D%3D.3-ccb7-5&ccb=7-5&_nc_sid=58cdad&_nc_ohc=0JakxTgp6n4Q7kNvwFFOYtL&_nc_oc=Adl4YTEmG-Oe-9nU4bur0-WtaX1FtHGIZ-UlHGTu8V7KQ68GGYuIl0efibC8ucjk5uA&_nc_ad=z-m&_nc_cid=0&_nc_zt=23&_nc_ht=scontent-gmp1-1.cdninstagram.com&_nc_gid=Qt5cD4wmcmiO35nhtwMq-Q&oh=00_AfKvNrj2_bOuWbIrICWP6pSNPNofc2Sr-D6vpzzqNNgpvQ&oe=6820E783,https://scontent-gmp1-1.cdninstagram.com/o1/v/t2/f2/m86/AQMxVvvuGw0HtMRzr86iplcBs2MAv8i49rxVEvmTDKS0Ypais2LxcnGuoSGPBqrg9-PzzW8x2Y6g_EljUBU3IJbS2r05Z3VFHiKvRX4.mp4?_nc_cat=100&_nc_sid=5e9851&_nc_ht=scontent-gmp1-1.cdninstagram.com&_nc_ohc=A16u3v3lPFQQ7kNvwFvuQcW&efg=eyJ2ZW5jb2RlX3RhZyI6Inhwdl9wcm9ncmVzc2l2ZS5JTlNUQUdSQU0uQ0xJUFMuQzMuNzIwLmRhc2hfYmFzZWxpbmVfMV92MSIsInhwdl9hc3NldF9pZCI6OTIyMTM3Njg5OTM3Nzg4LCJ2aV91c2VjYXNlX2lkIjoxMDA5OSwiZHVyYXRpb25fcyI6NDQsInVybGdlbl9zb3VyY2UiOiJ3d3cifQ%3D%3D&ccb=17-1&vs=bae8af382e8b7152&_nc_vs=HBksFQIYUmlnX3hwdl9yZWVsc19wZXJtYW5lbnRfc3JfcHJvZC9ENDRDMDM2NDA0MzI5QzE3MjM3Nzg2MjE1QTYxRUZBMl92aWRlb19kYXNoaW5pdC5tcDQVAALIAQAVAhg6cGFzc3Rocm91Z2hfZXZlcnN0b3JlL0dLeF9nUjEyd0RhMUxxb0RBSjFuVlo5d0tDUkticV9FQUFBRhUCAsgBACgAGAAbAogHdXNlX29pbAExEnByb2dyZXNzaXZlX3JlY2lwZQExFQAAJvjdipe9q6MDFQIoAkMzLBdARgQ5WBBiThgSZGFzaF9iYXNlbGluZV8xX3YxEQB1_gdl5p0BAA&_nc_zt=28&oh=00_AfLxMBCk4XboVHdy4ccT-q2ke6J2RwRXdTemh2ln4i_3KQ&oe=681CF965
3624794386141634869,1131199,2025-05-04 03:26:25+00:00,8,2885,3,"#광고 요즘 피부 왜 이렇게 예민하죠…? 거울 볼 때마다 한숨이 절로 나왔는데, #웰더마콜라겐마스크팩 한 장 붙이고 나니까, 고민 해결이죠 모 ㅎㅎ  팩 올리고 누워 있는 그 순간, “어머, 이 촉촉함 뭐지?” 리치한 에센스가 피부를 감싸는 느낌, 마치 피부가 콜라겐 에센스를 ‘꿀꺽’ 마시는 기분이었어요.  팩 떼고 나니까 미끈거리지 않고 보들보들 촉촉~ 쫀쫀함이 살아있어요. 덕분에 다음 날 화장도 예쁘게 잘 먹더라고요!  솔직히 마스크팩은 거기서 거기라고 생각했는데, 이건 피부가 바로 “나 지금 만족했어”라고 말하는 느낌이랄까요?  그리고 팩 붙이고 누워 있으니까 잠깐이지만 힐링되는 기분까지. 기분까지 리프레시 되는 소확행이랄까요? 요즘 같은 날씨에 딱이에요.  #웰더마 #콜라겐마스크팩 #수분충전 #피부진정 #홈케어루틴 #촉촉피부 #피부관리템 #마스크팩추천 #자기전피부관리 #피부회복템 #뷰티템 #셀프케어 #꿀피부 #쫀쫀피부 #피부탄력 #콜라겐충전 #오늘의소확행",DJN20oJzWE1,,
3624104147265792914,1131199,2025-05-03 04:36:21+00:00,2,3000,7,"#광고 @esthederm_kr   에스테덤 비타민 C2 미백앰플만 있으면,  우리집이 5성급 호텔 스파 🧖‍♀️  두가지 비타민C로 더 만족스러운 미백효과를 느껴볼 수 있더라구여!  사용 직전, 파우더와 에멀전 형태의 2가지 비타민C를 섞어서  바로 사용하는 특수 패키징 기법으로 사용 즉시 섞어 사용하니 더 좋더라구요.  뿌리깊은 다크스팟까지 연하게 - 만들어줄 수 있는데요. 성분 전문가 ‘디렉터파이’가 추천하는 데는 다 이유가 있더라고용!  이게 말만 그런게 아니라 찐으로 5성급 호텔 스파의 미백 프로그램에서 쓰는 앰플이랑  동일한 제품이라는 것! 진짜 우리집이 5성급 호텔 스파 부럽지 않져?   매일하는 항산화관리 더 쉽게 시작해보세요!   #비타민C세럼#스파미백앰플#미백더블업#디렉터파이추천#에스테덤#올영추천#올영픽#나오스#에코바이올로지#나오스에이징사이언스#싱글즈#인품사",DJLZ4VGzCuS,https://scontent-gmp1-1.cdninstagram.com/v/t51.2885-15/495126315_1199501285208206_6521458219117834345_n.jpg?stp=dst-jpg_e15_p360x360_tt6&efg=eyJ2ZW5jb2RlX3RhZyI6IkNMSVBTLmltYWdlX3VybGdlbi42NDB4MTEzNi5zZHIuZjcxODc4Lm5mcmFtZV9jb3Zlcl9mcmFtZSJ9&_nc_ht=scontent-gmp1-1.cdninstagram.com&_nc_cat=102&_nc_oc=Q6cZ2QEhR5i-u4yQ2VeaLXa-0NUeFJ7ETjEffhkThi2mZToUO-dpRLXzbZQjr85R2nvmeZI&_nc_ohc=afZOaTjuDGoQ7kNvwE9f5NF&_nc_gid=Qt5cD4wmcmiO35nhtwMq-Q&edm=ABmJApABAAAA&ccb=7-5&ig_cache_key=MzYyNDEwNDE0NzI2NTc5MjkxNA%3D%3D.3-ccb7-5&oh=00_AfIZfui6QR41FL8nrZ8Ufa5N9LhLpUr7b4zzEcXyS6Cm4g&oe=6820C3EC&_nc_sid=b41fef,https://scontent-gmp1-1.cdninstagram.com/o1/v/t16/f2/m261/AQN8Xv4W4Y9Znk0Wwn2dD540LvRiKRRxLDw75cax2mhPnJ-tLW-nSKyo5tzDnaHGMTtz1uP1DpevvixL1bX324iLuRSqH04WKqsmAw.mp4?_nc_cat=109&_nc_sid=8bf8fe&_nc_ht=scontent-gmp1-1.cdninstagram.com&_nc_ohc=ZmlIEgfMzfUQ7kNvwFziMNp&efg=eyJ2ZW5jb2RlX3RhZyI6Inhwdl9wcm9ncmVzc2l2ZS5JTlNUQUdSQU0uQ0xJUFMuQzMuMTQ0MC5yZW11eF9zb3VyY2UiLCJ4cHZfYXNzZXRfaWQiOjEwNTA1MjMxNzM2MTgyNDgsInZpX3VzZWNhc2VfaWQiOjEwODI3LCJkdXJhdGlvbl9zIjozMCwidXJsZ2VuX3NvdXJjZSI6Ind3dyJ9&ccb=17-1&_nc_zt=28&oh=00_AfLkDhDFNyaGlqPLhJpAqpdDrDjF6sqc2uPhQ26Wp6UfWg&oe=681CE5CF
3623340238476978256,1131199,2025-05-02 03:17:17+00:00,8,2844,6,"#르뷰체험단 @lushkorea  정말 러쉬는 L.O.V.E “가정의 달 5월, 러쉬로 향기롭게 마음을 전해봐요,, 우리..💐고마운 마음, 꼭 말로 해야 아는거 아니죠? 향기로 전하면 더 오래 기억될지도 몰라요☺️  이번 가정의 달엔 러쉬 선물 세트로 감사한 마음을 톡! 하고 전해보세요. 러쉬는 카카오톡 선물하기에서 간편하게 보낼 수 있고, 고민 없이 향기로운 선물이 되어줘요.  3만 원부터 7만 원대까지 가격대도 다양해서 예산 맞춰 선택할 수 있고요, 어떤 향을 골라도 다채롭고 기분 좋은 러쉬만의 감성이 느껴져요🌈 특히 시즌 한정 패키지는 보기만 해도 기분 좋아지는 디자인이라 받는 분도, 주는 나도 기분이 몽글몽글🎁  러쉬만의 향기와 감성이 담긴 선물로 이번 5월, 소중한 분들에게 ‘감사의 마음’을 전해보세요💌 스토리에서 바로 이동 가능해요🔗  #러쉬코리아 #가정의달선물 #5월선물 #카카오톡선물하기 #스승의날선물 #어버이날선물 #카톡선물 #성년의날선물 #향수선물추천 #향수선물 #로즈데이",DJIsL_mzKhQ,,
3622738581448008932,1131199,2025-05-01 07:24:17+00:00,2,2639,2,"#광고 @eucerin_kr  무려 올리브영 10년 연속 1위* 하는 아이크림 👀 바로 독일 No.1 안티에이징 브랜드** #유세린아이크림 이에요.  저도 늘 아이크림은 유세린만 고집하는 편! 눈가는 얼굴에서 가장 얇고 예민한 부위라서,, 더 꼼꼼하게 고르는데요. 유세린은 순한 저자극 크림이라 부담없이 사용하기 좋더라고요!   5중 주름 개선 효과***로 탄력 케어 맛집인데요. 3.7배 **** 더 빨라진 주름 개선 효과로 눈가는 기본이구 입가, 미간, 팔자주름까지 꼼꼼 케어해요!   *2014.01~2023.12 올리브영 소분류 ‘아이케어‘ 내 매출액 기준 1위 **IQVIA, 2019-2023 시장점유율 기준 ***피엔케이피부임상연구센터(주), 기기평가 결과, 기간 : 23.07.31 ~ 23.08.16 / 35~55세 여성 20명 ****피엔케이피부임상연구센타(주), 대조제품 자사 기존 유세린 하이알루론 아이크림 대비 기기평가 결과 / 기간 : 23.02.02 ~ 23.02.24 / 35~59세 여성 21명  #제품제공 #유세린 #아이크림 #1등아이크림 #올영아이크림 #유세린아이크림 #안티에이징 #주름개선 #눈가주름개선 #싱글즈 #인품사",DJGjYu1T6Tk,https://scontent-gmp1-1.cdninstagram.com/v/t51.2885-15/494766969_1394115438395495_7693346921494675956_n.jpg?stp=dst-jpg_e15_p360x360_tt6&efg=eyJ2ZW5jb2RlX3RhZyI6IkNMSVBTLmltYWdlX3VybGdlbi42NDB4MTEzNi5zZHIuZjcxODc4Lm5mcmFtZV9jb3Zlcl9mcmFtZSJ9&_nc_ht=scontent-gmp1-1.cdninstagram.com&_nc_cat=111&_nc_oc=Q6cZ2QEhR5i-u4yQ2VeaLXa-0NUeFJ7ETjEffhkThi2mZToUO-dpRLXzbZQjr85R2nvmeZI&_nc_ohc=knZia8zMvzMQ7kNvwHNkZjT&_nc_gid=Qt5cD4wmcmiO35nhtwMq-Q&edm=ABmJApABAAAA&ccb=7-5&ig_cache_key=MzYyMjczODU4MTQ0ODAwODkzMg%3D%3D.3-ccb7-5&oh=00_AfJpB8suTC6ePtgJBhISvFmI8bx2u7nVd8hYlWxDsjTIwg&oe=6820EC52&_nc_sid=b41fef,https://scontent-gmp1-1.cdninstagram.com/o1/v/t16/f2/m261/AQP-sryLIJW6ax6uiaaMt_aKAjVPJ_MOTzfdJwrziLYL1q7z7GxbwVP1SweAOiMrE0sy4F-qGvHNon8qe0JA74CSCtO_2JkKoUorew.mp4?_nc_cat=110&_nc_sid=8bf8fe&_nc_ht=scontent-gmp1-1.cdninstagram.com&_nc_ohc=Mjzu1FMWbDAQ7kNvwEBVMrb&efg=eyJ2ZW5jb2RlX3RhZyI6Inhwdl9wcm9ncmVzc2l2ZS5JTlNUQUdSQU0uQ0xJUFMuQzMuMTQ0MC5yZW11eF9zb3VyY2UiLCJ4cHZfYXNzZXRfaWQiOjE2OTc5Nzk5NjQxNTM2ODMsInZpX3VzZWNhc2VfaWQiOjEwODI3LCJkdXJhdGlvbl9zIjo0NSwidXJsZ2VuX3NvdXJjZSI6Ind3dyJ9&ccb=17-1&_nc_zt=28&oh=00_AfJCcAg_XJ8wahZHrcYiRk5dmVdchu8YlEEeGCFFuWmvQg&oe=681CE72A
3622177826600277197,1131199,2025-04-30 12:49:25+00:00,2,2947,4,"#광고 @healic_official  피부에 정말 순한 힐릭 선스크린 2종 각기 다른 매력이라 두개 다 있어야하는..!   톤업 선스크린과 워터리 선스크린 만나봤어요.  슬슬 - 햇살이 강해지는 제주에서 사실 4계절 선크림 필수인데요. 이맘때는 정말 더 신경 써줘야 하거든요!   화장 찐 잘 먹는 선크림 톤업 선스크린은 자연스럽게 피부를 반톤업! 해줘서  훨씬 생기있는 피부 표현 가능하고, 끼임이나 뭉침이 없어서 진짜 최고에요.  산뜻한 결보정에 좋은 워터리 선스크린은 쓰자마자 느껴지는 쿨링감  그리고 밸런스 케어로 들뜸 없는 결보정이 포인트인데요!   두 제품 모두 부드러운 생크림 제형이라  번들거리거나 밀림 없는게 진짜,, 사용감 최고에요.  #힐릭 #힐릭선스크린 #선스크린 #선크림",DJEj4rLzlTN,https://scontent-gmp1-1.cdninstagram.com/v/t51.2885-15/491895652_18503175703043200_56922929987383519_n.jpg?stp=dst-jpg_e15_p360x360_tt6&efg=eyJ2ZW5jb2RlX3RhZyI6IkNMSVBTLmltYWdlX3VybGdlbi43MjB4MTI4MC5zZHIuZjc1NzYxLmRlZmF1bHRfY292ZXJfZnJhbWUifQ&_nc_ht=scontent-gmp1-1.cdninstagram.com&_nc_cat=104&_nc_oc=Q6cZ2QEhR5i-u4yQ2VeaLXa-0NUeFJ7ETjEffhkThi2mZToUO-dpRLXzbZQjr85R2nvmeZI&_nc_ohc=9ke-ESBO8OsQ7kNvwHpL6jl&_nc_gid=Qt5cD4wmcmiO35nhtwMq-Q&edm=ABmJApABAAAA&ccb=7-5&ig_cache_key=MzYyMjE3NzgyNjYwMDI3NzE5NzE4NTAzMTc1Njk3MDQzMjAw.3-ccb7-5&oh=00_AfKrRqwmCfYlMCEwgZJadAnvqNoACnQXkS_-VClUpJpxaA&oe=6820E4BD&_nc_sid=b41fef,https://scontent-gmp1-1.cdninstagram.com/o1/v/t16/f2/m261/AQMy_8RKhUouwBnuexhxZHWnYWCqvnvyFgg8TKUmpHq48Zq4ptOC-NIZqCplhSOLy9KSkB8xnkEp6co6gZYibSMniMS1N1wE_ykycg.mp4?_nc_cat=108&_nc_sid=8bf8fe&_nc_ht=scontent-gmp1-1.cdninstagram.com&_nc_ohc=WgS7DuVlSRsQ7kNvwE60bro&efg=eyJ2ZW5jb2RlX3RhZyI6Inhwdl9wcm9ncmVzc2l2ZS5JTlNUQUdSQU0uQ0xJUFMuQzMuMTQ0MC5yZW11eF9zb3VyY2UiLCJ4cHZfYXNzZXRfaWQiOjExMzI3Mzc2Nzg4Njk4NTksInZpX3VzZWNhc2VfaWQiOjEwODI3LCJkdXJhdGlvbl9zIjo0OCwidXJsZ2VuX3NvdXJjZSI6Ind3dyJ9&ccb=17-1&_nc_zt=28&oh=00_AfJhNO3VedEsAr4y2f7cXRPfYim7D4a3h-Que36jGZqxOA&oe=681CE534
3622064030846036807,1131199,2025-04-30 09:01:41+00:00,8,2976,0,"🚽 변기 청소도 이젠 간편하게!요즘 제가 푹 빠진 욕실템 ✨바로 요고다 변기 청소 세트예요! 💧 물에 녹는 티슈라 사용 후 변기에 바로 쏙~🧼 티슈 안에 세정제 포함, 따로 세제 필요 없고🔄 곡선형 스틱 덕분에 구석구석 청소도 완벽!👆 원터치 버튼으로 티슈 교체도 간단🧺 전용 걸이로 깔끔 보관🛁 변기뿐 아니라 욕실 전반 청소 가능해요! 진심… 청소가 이렇게 쉬웠던가요?싫었던 변기 청소가 이제는 루틴 됐어요💙 #요고다변기청소세트 #변기청소 #욕실청소 #청소템추천#플러셔블티슈 #간편청소 #욕실루틴 #변기티슈 #살림템",DJEKAuoTCtH,,
3620603662894408451,1131199,2025-04-28 08:42:46+00:00,2,2735,5,"#협찬 @lecelle.official  나는 이제 인간 르셀르가 되..(ㅋㅋ) 르셀르 서포터즈1기, #르센트 가 되었어요.  이제 약 한달 동안은 매일매일 르센트와 함께 할 예정이에요. 다양한 제품들 그리고 향기들을 소개해 볼게요!   서포터즈 발대식에서 받은 리본 퍼퓸 키링은 넘 귀여운 키링 스타일의 방향제인데요. 프렌치 레몬은 상큼함 팡팡 터지는 향이라 어떤 공간에도 정말 잘 어울려요.   더 우드 19와 이네스 룸 스프레이는 내가 머무는 공간에 은은한 향기를 남기기 넘 좋은 제품이에요. 탈취효과도 좋으면서 잔향이 오래 남아 더 마음에 들었던! 이제 대용량 구매각입니당?  르셀르는 카카오톡 선물하기 그리고 올리브영에서도 만날 수 있어요!   #르셀르 #르셀르서포터즈 #향기장인 #룸스프레이 #르셀르키링 #리본퍼퓸키링",DI-99k_TKMD,https://scontent-gmp1-1.cdninstagram.com/v/t51.2885-15/491433889_1351379982646970_5665831055816107709_n.jpg?stp=dst-jpg_e15_p360x360_tt6&efg=eyJ2ZW5jb2RlX3RhZyI6IkNMSVBTLmltYWdlX3VybGdlbi42NDB4MTEzNi5zZHIuZjcxODc4Lm5mcmFtZV9jb3Zlcl9mcmFtZSJ9&_nc_ht=scontent-gmp1-1.cdninstagram.com&_nc_cat=102&_nc_oc=Q6cZ2QEhR5i-u4yQ2VeaLXa-0NUeFJ7ETjEffhkThi2mZToUO-dpRLXzbZQjr85R2nvmeZI&_nc_ohc=PzF0Vn85fcIQ7kNvwHPZEhU&_nc_gid=Qt5cD4wmcmiO35nhtwMq-Q&edm=ABmJApABAAAA&ccb=7-5&ig_cache_key=MzYyMDYwMzY2Mjg5NDQwODQ1MQ%3D%3D.3-ccb7-5&oh=00_AfIgL2fgDbjmGCI_HN-Izm4JpmrfN-AgTOGP7ejOyaXuQw&oe=6820C385&_nc_sid=b41fef,https://scontent-gmp1-1.cdninstagram.com/o1/v/t2/f2/m86/AQNQjwepXDR4AlWhzS25njzuldY-KYEA4hHgKw4Lugtrm4AxsGsgu3LcIIjgfnJ4NghvwAeFt56yGwlITRWKYDLAgvELtohd5eUf6pI.mp4?_nc_cat=100&_nc_sid=5e9851&_nc_ht=scontent-gmp1-1.cdninstagram.com&_nc_ohc=hagJwjnulIIQ7kNvwGosYEY&efg=eyJ2ZW5jb2RlX3RhZyI6Inhwdl9wcm9ncmVzc2l2ZS5JTlNUQUdSQU0uQ0xJUFMuQzMuNzIwLmRhc2hfYmFzZWxpbmVfMV92MSIsInhwdl9hc3NldF9pZCI6MjAzMzA5MTA1Mzg4NDgyNSwidmlfdXNlY2FzZV9pZCI6MTAwOTksImR1cmF0aW9uX3MiOjU4LCJ1cmxnZW5fc291cmNlIjoid3d3In0%3D&ccb=17-1&vs=2633e30ba7f8e700&_nc_vs=HBksFQIYUmlnX3hwdl9yZWVsc19wZXJtYW5lbnRfc3JfcHJvZC84MDRCNTFCQTlGRUM1NDI1RDBGMkE3MDZDNEY0QzI4MV92aWRlb19kYXNoaW5pdC5tcDQVAALIAQAVAhg6cGFzc3Rocm91Z2hfZXZlcnN0b3JlL0dOaWNlQjBRNkRabTE0a0RBQTJfQjRhM2w5NUxicV9FQUFBRhUCAsgBACgAGAAbAogHdXNlX29pbAExEnByb2dyZXNzaXZlX3JlY2lwZQExFQAAJrLWgOG8xZwHFQIoAkMzLBdATQzMzMzMzRgSZGFzaF9iYXNlbGluZV8xX3YxEQB1_gdl5p0BAA&_nc_zt=28&oh=00_AfJda5zvtFl5dSLGfi3qXwgHSFLGPdMN6rweTExoshDidw&oe=681CF879
